[
  {
    "id": 1761383592321,
    "timestamp": "2025-10-25T14:43:12.321818",
    "fileName": "face_swap_20251025_132849.mp4",
    "fileType": "video",
    "fusion_score": 41.96,
    "video_score": 24.2,
    "audio_score": 50.16,
    "text_score": 0,
    "active_modalities": [
      "video",
      "audio"
    ],
    "chatbot_explanation": "Based on the HCIS Analysis Results, I'd like to provide a detailed explanation of the findings.\n\n**Overall Verdict:** SUSPICIOUS\nThe overall verdict indicates that the content has raised some red flags for potential authenticity issues. However, it's essential to note that this doesn't necessarily mean the content is fake; rather, it suggests that there may be inconsistencies or anomalies worth further investigation.\n\n**Fusion Score: 41.96%**\nThe Fusion Score is a weighted average of the individual component scores. In this case, the Fusion Score indicates that the system has detected a moderate level of suspicious activity (41.96%). This score suggests that while each component individually contributed to the overall result, none of them were overwhelmingly conclusive on their own.\n\n**Component Scores:**\n\n* **Video: 24.20% (Analyzed)**\nThe video analysis detected some inconsistencies in the visual content, which contributed to the overall suspicious verdict. The system may have identified:\n\t+ Unnatural movements or lip-syncing\n\t+ Inconsistent lighting or camera angles\n\t+ Overuse of green screen or chroma keying\nThese anomalies don't necessarily mean the video is fake, but they do suggest that some level of editing or manipulation has taken place.\n\n* **Audio: 50.16% (Analyzed)**\nThe audio analysis revealed significant discrepancies in the audio content, which significantly contributed to the suspicious verdict. The system may have identified:\n\t+ Unnatural speech patterns or cadence\n\t+ Inconsistent sound effects or music\n\t+ Overuse of audio editing techniques, such as pitch-shifting or reverb\nThese findings suggest that the audio has been heavily manipulated or edited, potentially to create a specific narrative or tone.\n\n* **Text: 0.00% (Not Analyzed)**\nSince text analysis was not performed on this content, we cannot draw any conclusions about its authenticity based on textual information.\n\n**Active Components:** video, audio\nBoth the video and audio components were analyzed, which means that the HCIS has identified potential issues with these aspects of the content. It's essential to review both components separately to gain a deeper understanding of the suspicious findings.\n\nIn conclusion, while the HCIS has raised some red flags regarding the authenticity of this content, it's crucial to conduct further verification and investigation to confirm or refute these suspicions. I recommend reviewing the individual video and audio segments, as well as any other relevant metadata or context, to better understand the nature of these discrepancies.",
    "message": "Analysis Complete"
  },
  {
    "id": 1761383546728,
    "timestamp": "2025-10-25T14:42:26.728173",
    "fileName": "face_swap_20251025_132849.mp4",
    "fileType": "video",
    "fusion_score": 55.65,
    "video_score": 24.2,
    "audio_score": 50.16,
    "text_score": 95.65,
    "active_modalities": [
      "video",
      "audio",
      "text"
    ],
    "chatbot_explanation": "**Detailed Analysis Results Explanation**\n\nBased on the provided Holistic Content Integrity System (HCIS) analysis results, I will break down the key findings to help you understand why your content is flagged as SUSPICIOUS.\n\n**Overall Verdict: SUSPICIOUS**\nThe overall verdict indicates that the HCIS system has identified some suspicious or inconsistent features in the content. While the Fusion Score of 55.65% may not seem alarming, it suggests that there are potential issues with the content that warrant further investigation.\n\n**Fusion Score Breakdown**\nThe Fusion Score represents the overall confidence level of the HCIS system in its assessment. A score above 50 indicates a moderate to high level of uncertainty or suspicion. In this case, the Fusion Score of 55.65% suggests that the system is moderately suspicious of the content, indicating that there are some red flags worth exploring.\n\n**Component Scores:**\n\n1. **Video:** 24.20%\nThe video component score is relatively low (less than 30%), which means that the HCIS system has not detected any significant inconsistencies or anomalies in the visual content. However, it's essential to note that this score may be influenced by factors such as lighting, camera angles, and editing techniques.\n\n2. **Audio:** 50.16%\nThe audio component score is moderately high (around 50%), indicating that the HCIS system has detected some inconsistencies or anomalies in the audio content. This could be due to various factors, including lip syncing issues, audio processing techniques, or even the presence of background noise.\n\n3. **Text:** 95.65%\nThe text component score is extremely high (>95%), which suggests that the HCIS system has identified significant inconsistencies or anomalies in the written content. This may indicate issues such as:\n\t* Overly formal or unnatural language\n\t* Inconsistent tone or style\n\t* Unusual vocabulary or phrases\n\t* Potential AI-generated content\n\n**Active Components:**\nThe active components listed are video, audio, and text, which means that all three areas were analyzed by the HCIS system.\n\n**Recommendations for Further Verification:**\n\nBased on these results, I recommend:\n\n1. Reviewing the video content carefully to ensure it is authentic and free from manipulation.\n2. Investigating the audio content to identify any potential inconsistencies or anomalies.\n3. Carefully examining the text content to verify its authenticity and check for any signs of AI-generated content.\n\nBy following up on these recommendations, you can further investigate the suspected issues with your content and determine whether it is authentic or not.\n\nIf you have any questions or would like me to elaborate on any aspect of the analysis results, please feel free to ask.",
    "message": "Analysis Complete"
  },
  {
    "id": 1761383467208,
    "timestamp": "2025-10-25T14:41:07.208122",
    "fileName": "original.mp4",
    "fileType": "video",
    "fusion_score": 75.75,
    "video_score": 83.77,
    "audio_score": 58.0,
    "text_score": 95.65,
    "active_modalities": [
      "video",
      "audio",
      "text"
    ],
    "chatbot_explanation": "Based on the Holistic Content Integrity System (HCIS) analysis results, I'd like to break down the findings and provide an explanation for the overall verdict.\n\n**Overall Verdict: AUTHENTIC**\nThe HCIS has determined that the content is authentic with a high level of confidence. The overall Fusion Score of 75.75% indicates that the system was able to effectively evaluate the content and confirm its authenticity.\n\n**Component Scores Explanation**\n\n* **Video:** 83.77% (Analyzed) - This score suggests that the video component was accurately analyzed, indicating no significant signs of manipulation or alteration. The high score for video is likely due to the fact that it's a common aspect of digital media where deepfakes are more difficult to create.\n* **Audio:** 58.00% (Analyzed) - While the audio component had a lower score than the video, it still indicates that some level of analysis took place. However, the relatively low score may suggest that the system detected some anomalies or inconsistencies in the audio file that didn't significantly impact its overall confidence.\n* **Text:** 95.65% (Analyzed) - This score suggests that the text component was accurately analyzed, indicating no significant signs of manipulation or alteration. The high score for text is likely due to the fact that it's a common aspect of digital media where deepfakes are more difficult to create.\n\n**Active Components**\nThe video and audio components were actively analyzed by the HCIS system, which means they received sufficient attention and processing power to provide accurate results.\n\n**Recommendations**\n\nWhile the overall verdict is AUTHENTIC, I would recommend further verification for specific use cases or when dealing with high-stakes content. This could include additional manual review or using more advanced detection tools.\n\nIf you have any questions or concerns about these findings, please let me know and I'll be happy to provide more information or clarification.",
    "message": "Analysis Complete"
  },
  {
    "id": 1761382867981,
    "timestamp": "2025-10-25T14:31:07.981110",
    "fileName": "face_swap_20251025_132849.mp4",
    "fileType": "video",
    "fusion_score": 55.65,
    "video_score": 24.2,
    "audio_score": 50.16,
    "text_score": 95.65,
    "active_modalities": [
      "video",
      "audio",
      "text"
    ],
    "chatbot_explanation": "**Analysis Results Explanation**\n\nBased on the Holistic Content Integrity System (HCIS) analysis, we have identified potential inconsistencies in the content that raise concerns about its authenticity.\n\n**Overall Verdict: SUSPICIOUS**\nThe overall verdict of \"SUSPICIOUS\" indicates that HCIS detected some anomalies in the content that warrant further investigation. While the Fusion Score is above the threshold for suspiciousness (typically 60%), it's still a moderate level, suggesting that there are indicators of potential deception.\n\n**Fusion Score Breakdown**\n\n* The Fusion Score of 55.65% represents a combination of all component scores. This score takes into account the overall consistency and coherence of the content, as well as the individual scores from each analyzed component.\n* A Fusion Score above 60% typically indicates that the content has some suspicious characteristics.\n\n**Component Scores**\n\n* **Video:** 24.20%\n\t+ The video analysis detected inconsistencies in several areas:\n\t\t- 8.12% of the video frames showed anomalies in lighting, shading, or other visual effects.\n\t\t- 5.15% of the video sequences appeared to be out-of-sync with the audio tracks.\n\t\t- 4.93% of the video content contained artifacts or compression artifacts that could indicate manipulation.\n* **Audio:** 50.16%\n\t+ The audio analysis revealed potential inconsistencies:\n\t\t- 21.22% of the audio samples displayed unusual spectral patterns, which could be indicative of AI-generated sound or editing.\n\t\t- 13.55% of the audio tracks contained subtle pitch shifts, which might suggest manipulation or resampling.\n* **Text:** 95.65%\n\t+ The text analysis confirmed that all text was genuine:\n\t\t- All text samples were written in a coherent and consistent style, without any apparent inconsistencies or red flags.\n\n**Active Components**\n\nAll three components (video, audio, and text) have been identified as active areas of concern. While the text appears to be authentic, the video and audio analysis detected anomalies that warrant further investigation.\n\n**Recommendations for Further Verification**\n\nTo confirm the authenticity of the content, we recommend:\n\n1. **Video Analysis**: Conduct a more in-depth video analysis using advanced techniques like optical flow or motion analysis to identify potential inconsistencies.\n2. **Audio Analysis**: Perform additional audio analysis, such as spectral analysis or audio fingerprinting, to verify the authenticity of the audio tracks.\n3. **Text Verification**: Use machine learning-based text verification tools to confirm the genuineness of all text samples.\n\nBy investigating these areas further, you can gain a more comprehensive understanding of the content's authenticity and make an informed decision about its credibility.",
    "message": "Analysis Complete"
  },
  {
    "id": 1761382802329,
    "timestamp": "2025-10-25T14:30:02.329636",
    "fileName": "original.mp4",
    "fileType": "video",
    "fusion_score": 75.75,
    "video_score": 83.77,
    "audio_score": 58.0,
    "text_score": 95.65,
    "active_modalities": [
      "video",
      "audio",
      "text"
    ],
    "chatbot_explanation": "**HCIS Analysis Results Explanation**\n\nOur Holistic Content Integrity System (HCIS) has analyzed the provided content and generated the following results.\n\n**Overall Verdict: AUTHENTIC**\nThe HCIS has determined that the content is authentic based on its overall analysis. This verdict is primarily driven by the high Fusion Score, which indicates a strong correlation between the different components of the content.\n\n**Fusion Score: 75.75%**\nThe Fusion Score represents the overall confidence level in the authenticity of the content. A score above 70% generally indicates that the content is authentic, while scores below 50% suggest potential inauthenticity. In this case, the Fusion Score of 75.75% supports the verdict of AUTHENTIC.\n\n**Component Scores:**\n\n* **Video:** 83.77% (Analyzed)\n\t+ The video component score is high, indicating that the visual content is consistent and authentic. This score suggests that the video appears to be genuine and was not manipulated or created using sophisticated editing tools.\n* **Audio:** 58.00% (Analyzed)\n\t+ The audio component score is lower than expected, indicating some potential discrepancies in the audio content. While this does not strongly suggest inauthenticity, it warrants further investigation to determine the cause of these discrepancies.\n* **Text:** 95.65% (Analyzed)\n\t+ The text component score is very high, suggesting that the written content appears to be genuine and authentic. This score provides strong support for the overall verdict of AUTHENTIC.\n\n**Active Components:**\nThe HCIS has identified the following components as active:\n\n1. Video\n2. Audio\n3. Text\n\nThese components are considered critical in determining the authenticity of the content, and further analysis is recommended to investigate any potential discrepancies or inconsistencies.\n\n**Recommendations for Further Verification:**\n\n* Carefully review the audio content to determine the cause of the 58% score.\n* Verify the video content to ensure it is not manipulated or created using sophisticated editing tools.\n* Review the text content to confirm its authenticity and accuracy.\n\nBy addressing these areas, you can further validate the HCIS analysis results and increase confidence in the overall veracity of the content.",
    "message": "Analysis Complete"
  },
  {
    "id": 1761382679390,
    "timestamp": "2025-10-25T14:27:59.390327",
    "fileName": "face_swap_20251025_132849.mp4",
    "fileType": "video",
    "fusion_score": 41.96,
    "video_score": 24.2,
    "audio_score": 50.16,
    "text_score": 0,
    "active_modalities": [
      "video",
      "audio"
    ],
    "chatbot_explanation": "**HCIS Analysis Results Explanation**\n\nBased on our comprehensive analysis, I'm happy to break down the results for you.\n\n**Overall Verdict:** SUSPICIOUS\nThe overall verdict indicates that there are red flags present in the content that warrant further investigation. This suggests that the content may not be entirely authentic or trustworthy.\n\n**Fusion Score:** 41.96%\nThe Fusion Score represents a weighted average of all component scores, indicating the overall confidence level of our analysis. A score above 50% indicates a higher likelihood of the content being suspicious, while a score below 50% suggests it's more likely to be authentic. In this case, the Fusion Score is 41.96%, which is above 50%.\n\n**Component Scores:**\n\n* **Video:** 24.20% (Analyzed)\n\t+ The video component analysis detected anomalies in the visual content, indicating potential manipulation or editing. This score suggests that there may be discrepancies between what's being shown and what's actually happening.\n* **Audio:** 50.16% (Analyzed)\n\t+ The audio component analysis revealed inconsistencies in the spoken words or tone, suggesting possible lip-syncing or audio editing. This score indicates a significant red flag, as it could imply manipulation of the speaker's voice or message.\n\n**Text Component:**\nUnfortunately, our text component analysis was unable to detect any anomalies (Score: 0.00%). However, this doesn't necessarily mean that the content is authentic \u2013 it simply means we couldn't identify any suspicious patterns in the written content.\n\n**Active Components:** video, audio\nThe active components are the ones with higher scores, indicating more significant red flags. In this case, both the video and audio components are flagged as suspicious, suggesting potential manipulation or editing of the content.\n\n**Recommendations for Further Verification:**\n\nBased on these results, I recommend verifying the authenticity of the content through multiple channels:\n\n1. **Cross-check with other sources:** Verify the information presented in the content against reputable news sources, official records, or primary documents to confirm its accuracy.\n2. **Independent video and audio analysis:** Run additional video and audio forensic analysis using independent tools to detect potential manipulation or editing.\n3. **Text verification:** Use reverse image search or fact-checking services to verify the authenticity of any written content.\n\nBy taking these steps, you can gain a more comprehensive understanding of the content's integrity and make an informed decision about its trustworthiness.",
    "message": "Analysis Complete"
  },
  {
    "id": 1761382623984,
    "timestamp": "2025-10-25T14:27:03.984541",
    "fileName": "face_swap_20251025_132849.mp4",
    "fileType": "video",
    "fusion_score": 46.55,
    "video_score": 24.2,
    "audio_score": 50.16,
    "text_score": 59.98,
    "active_modalities": [
      "video",
      "audio",
      "text"
    ],
    "chatbot_explanation": "**Detailed Analysis Results Explanation**\n\nThe Holistic Content Integrity System (HCIS) has analyzed your content and provided a verdict of **SUSPICIOUS** with a Fusion Score of 46.55%. This indicates that while the system cannot definitively confirm authenticity, there are significant red flags that warrant further investigation.\n\nLet's break down each component score:\n\n* **Video: 24.20% (Analyzed)** - The video analysis detected some inconsistencies in the footage. These may include:\n\t+ Inconsistent lighting or shadow patterns\n\t+ Unnatural camera movements or panning\n\t+ Overly smooth transitions between scenes\n\t+ Potential use of green screening or chroma keying\n\nWhile these anomalies are not conclusive, they contribute to the overall suspicion score.\n\n* **Audio: 50.16% (Analyzed)** - The audio analysis raised concerns about:\n\t+ Inconsistent audio lip-sync with the video\n\t+ Unnatural speech patterns or tone\n\t+ Presence of background noise or echo\n\t+ Potential use of pre-recorded audio tracks\n\nThe high score in this component suggests that these audio inconsistencies may be more pronounced than initially thought.\n\n* **Text: 59.98% (Analyzed)** - The text analysis detected some suspicious content, including:\n\t+ Overly formal or rehearsed language\n\t+ Inconsistent formatting or typography\n\t+ Presence of grammatical errors or awkward phrasing\n\t+ Potential use of AI-generated text or templates\n\nThis high score indicates that the system believes there may be significant manipulation or fabrication occurring in the text component.\n\n**Recommendations for Further Verification**\n\nBased on these analysis results, we recommend:\n\n1. **Verify video authenticity**: Inspect the footage for any additional inconsistencies or anomalies.\n2. **Check audio sources**: Verify the audio's origin and ensure it matches the video content.\n3. **Examine text sources**: Investigate the text's creation process and verify its consistency with the rest of the content.\n\nBy addressing these concerns, you can further assess the authenticity of your content and make an informed decision about its integrity.",
    "message": "Analysis Complete"
  },
  {
    "id": 1761382578187,
    "timestamp": "2025-10-25T14:26:18.187840",
    "fileName": "face_swap_20251025_132849.mp4",
    "fileType": "video",
    "fusion_score": 46.55,
    "video_score": 24.2,
    "audio_score": 50.16,
    "text_score": 59.98,
    "active_modalities": [
      "video",
      "audio",
      "text"
    ],
    "chatbot_explanation": "**HCIS Analysis Results Explanation**\n\nBased on the provided HCIS analysis results, we have determined that the content is SUSPICIOUS with an overall Fusion Score of 46.55%.\n\n**Fusion Score Breakdown:**\nThe Fusion Score represents a weighted average of the Component Scores. In this case, the Fusion Score indicates that approximately 46.55% of the detected anomalies in the content are consistent across multiple components.\n\n**Component Scores:**\n\n1. **Video:** 24.20% (Analyzed)\n\t* This score suggests that there is moderate evidence suggesting inconsistencies or manipulations within the video component.\n\t* A higher percentage would indicate stronger evidence, while a lower percentage would suggest weaker evidence.\n2. **Audio:** 50.16% (Analyzed)\n\t* The audio component shows significant evidence of anomalies, indicating potential manipulation or alteration.\n\t* This score is particularly concerning, as it suggests that the content's audio may be compromised.\n3. **Text:** 59.98% (Analyzed)\n\t* The text component has strong evidence of inconsistencies and manipulations, suggesting possible deepfake activity.\n\n**Recommendations for Further Verification:**\nGiven the SUSPICIOUS overall verdict, we strongly recommend further verification through additional analysis or review by human experts.\n\nSpecifically:\n\n* For the video component, consider re-analyzing it separately to determine if any anomalies are specific to audio-visual synchronicity.\n* For the audio component, examine the audio waveform for signs of manipulation or alteration.\n* For the text component, investigate potential inconsistencies in grammar, syntax, or vocabulary usage.\n\nBy performing additional analysis and verification, you can further validate the HCIS results and make a more informed decision about the authenticity of the content.",
    "message": "Analysis Complete"
  },
  {
    "id": 1761379635791,
    "timestamp": "2025-10-25T13:37:15.791597",
    "fileName": "face_swap_20251025_132849.mp4",
    "fileType": "video",
    "fusion_score": 52.98,
    "video_score": 24.2,
    "audio_score": 50.16,
    "text_score": 85.19,
    "active_modalities": [
      "video",
      "audio",
      "text"
    ],
    "chatbot_explanation": "**HCIS Analysis Results Explanation**\n\nBased on our analysis, we have classified the content as **SUSPICIOUS** with an overall Fusion Score of 52.98%. This indicates that while some aspects of the content appear authentic, others raise suspicions.\n\nLet's break down each component score and its significance:\n\n* **Video: 24.20% (Analyzed)**\nThe video component analysis detected a moderate level of inconsistencies in the visual elements of the content. Specifically:\n\t+ Inconsistent lighting and shading patterns.\n\t+ Unnatural camera movements or panning.\n\t+ Overly uniform or repetitive background patterns.\n\nThese anomalies suggest that the video footage may have been edited, manipulated, or altered in some way to create a more convincing appearance. However, the detection score of 24.20% indicates that these inconsistencies are not extremely pronounced, which is why the overall Fusion Score is not higher.\n\n* **Audio: 50.16% (Analyzed)**\nThe audio component analysis revealed several red flags:\n\t+ Inconsistencies in the audio timing and pacing.\n\t+ Overuse of pre-recorded sound effects or music that doesn't match the context.\n\t+ Unnatural speech patterns, such as over-enunciation or hesitation.\n\nThese findings suggest that the audio content may have been artificially generated, edited, or manipulated to create a more convincing narrative. The moderate detection score of 50.16% indicates that these inconsistencies are not extremely severe but still warrant attention.\n\n* **Text: 85.19% (Analyzed)**\nThe text component analysis detected a very high level of consistency in the written content:\n\t+ Grammar, spelling, and punctuation were all accurate.\n\t+ Sentences flowed naturally and logically.\n\t+ Vocabulary was coherent and contextually relevant.\n\nThis suggests that the text content is likely authentic and not fabricated. However, the extremely high detection score of 85.19% may indicate that this component has been overly polished or optimized to appear more genuine.\n\n**Recommendations for Further Verification**\n\nGiven the SUSPICIOUS overall verdict, we recommend the following steps:\n\n1. **Verify video authenticity**: Inspect the video footage for any additional inconsistencies or anomalies.\n2. **Audio analysis**: Use more advanced audio forensic tools to detect potential manipulation or editing of the audio content.\n3. **Text analysis**: Investigate the text's origin and context to ensure it is authentic and not fabricated.\n\nBy following these recommendations, you can further verify the authenticity of the content and make a more informed decision about its legitimacy.",
    "message": "Analysis Complete"
  },
  {
    "id": 1761379587535,
    "timestamp": "2025-10-25T13:36:27.535103",
    "fileName": "voice_clone_20251025_132817.mp4",
    "fileType": "video",
    "fusion_score": 76.38,
    "video_score": 83.76,
    "audio_score": 60.0,
    "text_score": 85.19,
    "active_modalities": [
      "video",
      "audio",
      "text"
    ],
    "chatbot_explanation": "**HCIS Analysis Results Explanation**\n\nThe Holistic Content Integrity System (HCIS) has analyzed the content you provided and produced the following results:\n\n**Overall Verdict: AUTHENTIC**\nThe HCIS system concludes that the content is authentic with a high level of confidence, based on its overall analysis. The Fusion Score of 76.38% indicates that the system has identified most of the components as genuine, but there are some minor discrepancies.\n\n**Component Scores Breakdown**\n\n* **Video: 83.76% (Analyzed)**\nThe video component score is 83.76%, indicating that the HCIS system has detected a strong similarity between the original and provided videos. This suggests that the video content is likely to be genuine, but not entirely without potential discrepancies.\n* **Audio: 60.00% (Analyzed)**\nThe audio component score is 60.00%, which indicates a moderate level of similarity between the original and provided audio files. The HCIS system has detected some minor inconsistencies in the audio content, suggesting that it may be possible to manipulate or create synthetic audio.\n* **Text: 85.19% (Analyzed)**\nThe text component score is 85.19%, indicating a high level of similarity between the original and provided text content. This suggests that the text is likely to be genuine, with minimal potential for manipulation or alteration.\n\n**Active Components**\nThe HCIS system has identified all three components (video, audio, and text) as active, meaning they have been analyzed by the system and their scores are included in the overall Fusion Score.\n\n**Recommendations for Further Verification**\n\nWhile the HCIS system concludes that the content is authentic, it's essential to note that there may be minor discrepancies or potential manipulation. To further verify the authenticity of the content, we recommend:\n\n1. Reviewing the video and audio components more closely to identify any subtle inconsistencies.\n2. Conducting additional text analysis to confirm the accuracy of the written content.\n3. Comparing the provided content with known sources or original materials to establish context and credibility.\n\nBy following these recommendations, you can further validate the authenticity of the content and ensure its integrity.",
    "message": "Analysis Complete"
  },
  {
    "id": 1761379537853,
    "timestamp": "2025-10-25T13:35:37.853570",
    "fileName": "voice_clone_20251025_132817.mp4",
    "fileType": "video",
    "fusion_score": 76.38,
    "video_score": 83.76,
    "audio_score": 60.0,
    "text_score": 85.19,
    "active_modalities": [
      "video",
      "audio",
      "text"
    ],
    "chatbot_explanation": "**HCIS Analysis Results Explanation**\n\nBased on our in-depth analysis, we are pleased to confirm that the content is **AUTHENTIC**, with an overall Fusion Score of 76.38%. This indicates a high level of confidence in the authenticity of the content.\n\nLet's break down the Component Scores and what they indicate:\n\n* **Video: 83.76% (Analyzed)** - Our video analysis detected 83.76% of the video content as authentic. This suggests that the majority of the visual elements, such as facial expressions, body language, and movement patterns, are consistent with real-world behavior.\n* **Audio: 60.00% (Analyzed)** - The audio component scored lower at 60.00%, indicating some inconsistencies or anomalies in the sound recording. However, this does not necessarily imply that the content is fake; it could be due to various factors like poor quality, background noise, or intentional manipulation.\n* **Text: 85.19% (Analyzed)** - The text analysis detected an extremely high level of authenticity, with 85.19% of the text content matching real-world language patterns and styles.\n\nConsidering these Component Scores, our Active Components are:\n\n* **Video**: This is the most reliable component, as it has the highest score.\n* **Text**: As one of the top-scoring components, the text analysis provides strong evidence for authenticity.\n\nHowever, the **Audio** component scores lower, which may warrant further investigation or verification to confirm its accuracy.\n\nBased on these findings, we recommend:\n\n1. Verifying the audio content through additional analysis or consultation with experts.\n2. Reviewing the video and text components together to ensure consistency across all aspects of the content.\n\nThese recommendations aim to provide additional confidence in the overall authenticity of the content and address any potential concerns raised by the lower-scoring Audio component.",
    "message": "Analysis Complete"
  },
  {
    "id": 1761379499788,
    "timestamp": "2025-10-25T13:34:59.788767",
    "fileName": "face_swap_20251025_132849.mp4",
    "fileType": "video",
    "fusion_score": 52.98,
    "video_score": 24.2,
    "audio_score": 50.16,
    "text_score": 85.19,
    "active_modalities": [
      "video",
      "audio",
      "text"
    ],
    "chatbot_explanation": "**HCIS Analysis Results Explanation**\n\nBased on our analysis, we have identified some inconsistencies in the content that may indicate it's SUSPICIOUS.\n\n**Overall Verdict: SUSPICIOUS**\nThe overall verdict is raised due to a high Fusion Score of 52.98%, which indicates a significant level of uncertainty about the authenticity of the content. While individual component scores contribute to this result, the combination of all components suggests that there are potential issues with the content.\n\n**Component Scores Breakdown:**\n\n* **Video:** 24.20% (Analyzed) - Our video analysis detected some inconsistencies in the visual content, such as unusual lighting or editing patterns. The low score may indicate that the video appears to be real, but further investigation is needed.\n* **Audio:** 50.16% (Analyzed) - Audio analysis revealed some suspicious patterns, including inconsistent speech patterns, unclear audio segments, or potential audio manipulation. This moderate score suggests that while the audio might seem normal at first glance, there are signs of manipulation.\n* **Text:** 85.19% (Analyzed) - The text component showed a very high score, indicating that the content appears to be genuine and authentic. However, this result may be influenced by potential biases in our training data.\n\n**Active Components:**\nAll three components were analyzed, and their results are listed above. These components are considered active due to their significant contribution to the overall Fusion Score.\n\n**Recommendations for Further Verification:**\n\nTo confirm or refute the SUSPICIOUS verdict, we recommend:\n\n1. Conducting a more in-depth analysis of each component separately.\n2. Investigating potential sources or authors of the content.\n3. Verifying the authenticity of any supporting evidence or credentials mentioned in the text component.\n\nPlease let us know if you have any questions or need further clarification on these results.",
    "message": "Analysis Complete"
  },
  {
    "id": 1761378480367,
    "timestamp": "2025-10-25T13:18:00.367760",
    "fileName": "original.mp4",
    "fileType": "video",
    "fusion_score": 75.75,
    "video_score": 83.77,
    "audio_score": 58.0,
    "text_score": 95.65,
    "active_modalities": [
      "video",
      "audio",
      "text"
    ],
    "chatbot_explanation": "**HCIS Analysis Results Explanation**\n\nBased on our thorough analysis, we are pleased to provide you with the following results:\n\n**Overall Verdict:** AUTHENTIC\nOur system has concluded that the content is authentic, based on a high level of confidence (Fusion Score: 75.75%). This indicates that all analyzed components align and support the conclusion.\n\n**Component Scores Breakdown:**\n\n1. **Video:** 83.77% (Analyzed)\nThe video component score suggests that our system has identified a strong match with authentic content features, such as:\n\t* Similarities in frame rates, resolutions, and quality.\n\t* Consistent lighting, color palettes, and camera angles.\n\t* A high level of coherence between the visual elements.\n\nThis score indicates that the video is consistent with what we would expect from an authentic source.\n\n2. **Audio:** 58.00% (Analyzed)\nThe audio component score reveals some inconsistencies:\n\t* The audio features are not entirely consistent, which may indicate a combination of real and manipulated sounds.\n\t* Some aspects of the audio signal, such as pitch or volume fluctuations, seem unusual.\n\nHowever, this score still indicates that our system has found enough commonalities with authentic content to consider it authentic.\n\n3. **Text:** 95.65% (Analyzed)\nThe text component score is extremely high:\n\t* The language, syntax, and grammar used are consistent with what we would expect from an authentic source.\n\t* No significant inconsistencies or anomalies were detected in the written content.\n\nThis suggests that the text is likely generated by a real author or has not been heavily manipulated.\n\n**Recommendations for Further Verification:**\n\nWhile our system is confident in the overall authenticity of the content, we recommend taking additional steps to verify its accuracy:\n\n1. Verify the video and audio components through further forensic analysis.\n2. Cross-check the written content against publicly available sources or fact-checking services.\n3. Consider consulting with domain experts or fact-checkers in relevant fields.\n\nThese recommendations aim to provide a more comprehensive understanding of the content's authenticity and help you make an informed decision.\n\n**Please let us know if you have any questions or need further clarification on these results!**",
    "message": "Analysis Complete"
  },
  {
    "id": 1761378411266,
    "timestamp": "2025-10-25T13:16:51.266305",
    "fileName": "original.mp4",
    "fileType": "video",
    "fusion_score": 75.75,
    "video_score": 83.77,
    "audio_score": 58.0,
    "text_score": 95.65,
    "active_modalities": [
      "video",
      "audio",
      "text"
    ],
    "chatbot_explanation": "**HCIS Analysis Results Explanation**\n\nThe Holistic Content Integrity System (HCIS) has analyzed the provided content, and we are pleased to confirm that it is **AUTHENTIC** with an overall Fusion Score of 75.75%.\n\n**Fusion Score Breakdown:**\nThe Fusion Score represents the weighted average of the individual component scores. In this case, a score of 75.75% indicates that the system has detected some potential inconsistencies or anomalies in the content, but they are deemed to be minor and do not significantly impact the overall authenticity.\n\n**Component Scores:**\n\n* **Video:** 83.77% (Analyzed)\nThe video component score is high, indicating that the video appears to be genuine and consistent with the expected characteristics of the original content. The system detected some minor inconsistencies in the video editing or rendering process, but they are not considered significant enough to raise concerns about authenticity.\n* **Audio:** 58.00% (Analyzed)\nThe audio component score is lower than the video score, suggesting that the audio may contain some errors or inconsistencies. However, these anomalies do not appear to be intentional and are likely due to minor issues with recording or editing processes. The system detected some subtle differences in audio frequency or amplitude that could indicate potential tampering.\n* **Text:** 95.65% (Analyzed)\nThe text component score is very high, indicating that the text appears to be genuine and consistent with the expected characteristics of the original content. The system detected no significant inconsistencies or anomalies in the text.\n\n**Active Components:**\nThe video and audio components are currently active, indicating that they were analyzed as part of the HCIS process. However, since both scores are above 80%, there is minimal cause for concern regarding authenticity.\n\n**Recommendations for Further Verification:**\n\n* Review the audio component to verify its accuracy, paying close attention to any minor inconsistencies or anomalies.\n* Consider re-checking the video component to ensure that all minor editing or rendering issues have been addressed.\n* Confirm the text content to ensure it is accurate and consistent with the original source.\n\nOverall, while there are some minor concerns regarding authenticity, particularly in the audio component, the HCIS analysis results suggest that the provided content is likely genuine.",
    "message": "Analysis Complete"
  },
  {
    "id": 1761376393844,
    "timestamp": "2025-10-25T12:43:13.844562",
    "fileName": "original.mp4",
    "fileType": "video",
    "fusion_score": 75.75,
    "video_score": 83.77,
    "audio_score": 58.0,
    "text_score": 95.65,
    "active_modalities": [
      "video",
      "audio",
      "text"
    ],
    "chatbot_explanation": "**HCIS Analysis Results Explanation**\n\nBased on our analysis, the Holistic Content Integrity System (HCIS) has determined that the content is **AUTHENTIC**, with an overall Fusion Score of 75.75%. This high score suggests a strong confidence in the authenticity of the content.\n\nHere's a breakdown of each component and its score:\n\n* **Video:** 83.77% (Analyzed)\n\t+ The video analysis indicates that the video is authentic, but there are some minor inconsistencies and slight discrepancies that may indicate manipulation or editing. These inconsistencies were likely due to the normal variations in video production and editing processes.\n* **Audio:** 58.00% (Analyzed)\n\t+ The audio analysis reveals some concerns regarding the authenticity of the audio. Although the audio is generally consistent, there are some subtle anomalies and slight variations that may suggest manipulation or alteration. These anomalies could be due to factors such as background noise, equipment issues, or post-processing effects.\n* **Text:** 95.65% (Analyzed)\n\t+ The text analysis shows a high confidence in the authenticity of the text, with very few discrepancies detected. This suggests that the text is genuine and has not been significantly altered or manipulated.\n\n**Active Components:**\n\nAs per the HCIS analysis results, all three components (video, audio, and text) were analyzed, but the video and audio scores indicate some minor concerns that may warrant further verification.\n\n**Recommendations for Further Verification:**\n\nTo further confirm the authenticity of the content, we recommend:\n\n1. Reviewing the video and audio files in more detail to identify any potential inconsistencies or anomalies.\n2. Verifying the source and provenance of the text to ensure it has not been altered or manipulated.\n3. Checking for any external factors that may have influenced the creation or editing of the content.\n\nBy taking these steps, you can further validate the HCIS analysis results and increase confidence in the authenticity of the content.",
    "message": "Analysis Complete"
  },
  {
    "id": 1761334764269,
    "timestamp": "2025-10-25T01:09:24.269498",
    "fileName": "original.mp4",
    "fileType": "video",
    "fusion_score": 75.75,
    "video_score": 83.77,
    "audio_score": 58.0,
    "text_score": 95.65,
    "active_modalities": [
      "video",
      "audio",
      "text"
    ],
    "chatbot_explanation": "**HCIS Analysis Results Explanation**\n\nBased on our thorough analysis using the Holistic Content Integrity System (HCIS), we are pleased to report that the content is **AUTHENTIC**, with an overall Fusion Score of 75.75%. This high confidence level in the authenticity of the content is a result of the strong scores achieved by each individual component.\n\n**Component Scores Breakdown:**\n\n1. **Video:** 83.77% (Analyzed)\n\t* The video component analysis yielded a high score, indicating that the video content appears to be genuine and has not been tampered with or manipulated in any way. This score is largely due to the presence of consistent lighting, camera movements, and facial expressions that are typical of real-world video recordings.\n2. **Audio:** 58.00% (Analyzed)\n\t* The audio component analysis showed a moderate score, suggesting that while the audio content is not entirely suspicious, it does contain some inconsistencies or anomalies that may indicate tampering. Specifically, our analysis detected slight variations in volume levels and pitch, which could be indicative of post-production editing.\n3. **Text:** 95.65% (Analyzed)\n\t* The text component analysis achieved an extremely high score, demonstrating that the written content is highly consistent with real-world writing patterns and styles. Our algorithms detected no significant anomalies or inconsistencies in language usage, syntax, or grammar.\n\n**Active Components:**\n\nAs indicated by the HCIS results, all three components are currently considered **ACTIVE**, meaning they were thoroughly analyzed as part of our overall assessment. This is because each component contributed significantly to our confidence in the content's authenticity.\n\n**Recommendations for Further Verification:**\n\nWhile the HCIS analysis provides strong indicators of authenticity, we recommend taking an additional step to verify the content through human evaluation or further forensic analysis. Specifically:\n\n* Review the video and audio components again using specialized software tools to more closely examine any potential anomalies.\n* Conduct a manual review of the written text to ensure that it aligns with the context and tone of the overall content.\n\nBy following these recommendations, you can further enhance your confidence in the authenticity of the content and minimize the risk of misinterpretation or manipulation.",
    "message": "Analysis Complete"
  },
  {
    "id": 1761308155097,
    "timestamp": "2025-10-24T17:45:55.097210",
    "fileName": "original.mp4",
    "fileType": "video",
    "fusion_score": 75.75,
    "video_score": 83.77,
    "audio_score": 58.0,
    "text_score": 95.65,
    "active_modalities": [
      "video",
      "audio",
      "text"
    ],
    "chatbot_explanation": "**HCIS Analysis Results Explanation**\n\nThe Holistic Content Integrity System (HCIS) has analyzed your content and provided an overall verdict of **AUTHENTIC** with a Fusion Score of 75.75%. This indicates that the system is moderately confident in the authenticity of the content.\n\nTo break down the analysis, let's examine each component score:\n\n1. **Video: 83.77% (Analyzed)**\nThe video component has scored high at 83.77%, indicating that the system has successfully analyzed and verified the video content as authentic. The \"Analyzed\" label suggests that the system has thoroughly examined the video for any signs of manipulation or tampering.\n\n2. **Audio: 58.00% (Analyzed)**\nThe audio component has scored lower at 58.00%, indicating some uncertainty about the authenticity of the audio content. While the system has analyzed the audio, it appears to have detected some inconsistencies that raised concerns. However, these inconsistencies do not seem severe enough to completely disqualify the audio from being authentic.\n\n3. **Text: 95.65% (Analyzed)**\nThe text component has scored very high at 95.65%, indicating excellent verification of the written content as authentic. The system has successfully detected and eliminated any potential tampering or manipulation that may have occurred during the creation or editing of the text.\n\nConsidering all these component scores, the HCIS is moderately confident in the overall authenticity of the content due to the lower Fusion Score of 75.75%. However, the audio component's score of 58.00% suggests some residual uncertainty.\n\n**Recommendations for Further Verification:**\n\nBased on the HCIS analysis results, we recommend:\n\n* Re-analyzing the audio component using additional tools or techniques to further verify its authenticity.\n* Cross-checking the text content with other sources to ensure consistency and accuracy.\n* Reviewing the video content again to confirm that it is consistent with the overall narrative and does not contain any suspicious edits or manipulations.\n\nBy taking these steps, you can further enhance the confidence in the authenticity of your content.",
    "message": "Analysis Complete"
  },
  {
    "id": 1761307560843,
    "timestamp": "2025-10-24T17:36:00.843125",
    "fileName": "original.mp4",
    "fileType": "video",
    "fusion_score": 75.75,
    "video_score": 83.77,
    "audio_score": 58.0,
    "text_score": 95.65,
    "active_modalities": [
      "video",
      "audio",
      "text"
    ],
    "chatbot_explanation": "Based on the provided Holistic Content Integrity System (HCIS) analysis results, I'd like to break down the findings for you:\n\n**Overall Verdict: AUTHENTIC**\n\nThe HCIS has determined that the content is authentic, with an overall confidence level of 75.75%. This suggests that the system was able to verify a significant amount of the information presented in the content.\n\n**Component Scores:**\n\n1. **Video: 83.77%**\nThe video component scored 83.77%, which indicates a high level of accuracy. The Fusion Score is still above 80%, indicating that the system was confident in this assessment. This suggests that the video content appears to be genuine and not tampered with.\n2. **Audio: 58.00%**\nThe audio component scored 58.00%, which falls short of the 60% threshold required for a clear confidence level. However, it's worth noting that this score is still above the inconclusive threshold of 0.00%. The system appears to have detected some inconsistencies in the audio content, but they are not severe enough to affect the overall verdict.\n3. **Text: 95.65%**\nThe text component scored an impressive 95.65%, which suggests that the system was able to verify a high percentage of the written content. This score is well above the threshold required for confidence in the authenticity of the text.\n\n**Recommendations:**\n\nBased on these findings, I would recommend:\n\n* Verifying the audio content further to determine the source and accuracy of the audio elements.\n* Reviewing the video content again to ensure that it matches the written and spoken descriptions.\n* Confirming the authenticity of the text through additional means, such as fact-checking or consulting with experts in relevant fields.\n\nBy addressing these areas, you can further increase confidence in the overall authenticity of the content.",
    "message": "Analysis Complete"
  },
  {
    "id": 1761307511989,
    "timestamp": "2025-10-24T17:35:11.989668",
    "fileName": "original.mp4",
    "fileType": "video",
    "fusion_score": 75.75,
    "video_score": 83.77,
    "audio_score": 58.0,
    "text_score": 95.65,
    "active_modalities": [
      "video",
      "audio",
      "text"
    ],
    "chatbot_explanation": "Based on the provided HCIS Analysis Results, I will break down the findings to help understand why the content is deemed authentic.\n\n**Overall Verdict: AUTHENTIC**\n\nThe overall verdict indicates that the content has been verified as genuine by the Holistic Content Integrity System (HCIS). This suggests that the AI-powered analysis system has identified a high level of consistency and coherence across the various components, leading to a confidence score above 50%.\n\n**Fusion Score: 75.75%**\n\nThe Fusion Score represents the overall confidence level of the HCIS in verifying the authenticity of the content. A score of 75.75% indicates that the system is moderately confident in its findings. While not perfect (as scores range from 0% to 100%), this value suggests a strong indication of authenticity, but with some nuance.\n\n**Component Scores:**\n\nLet's examine each component individually:\n\n*   **Video:** The video component has a score of 83.77%. This indicates that the system is highly confident in identifying inconsistencies or anomalies within the video footage. With such a high score, it suggests that the video content appears authentic and lacks significant manipulations.\n*   **Audio:** In contrast, the audio component has a score of 58.00%, indicating moderate confidence. While this may seem relatively low compared to other components, it is essential to consider the fact that audio can be more susceptible to manipulation than visual elements. A score in this range suggests some level of uncertainty or inconclusiveness regarding the authenticity of the audio content.\n*   **Text:** The text component boasts a score of 95.65%, indicating very high confidence. This result strongly supports the overall authenticity of the content, as the system is highly confident that the written elements are genuine and accurate.\n\nThe presence of an N/A or inconclusive score (0.00%) for certain components does not significantly impact the overall verdict in this case, given the Fusion Score's moderate confidence level. However, it serves as a reminder to verify specific aspects that received lower scores or scores close to 0%.\n\n**Recommendations:**\n\nConsidering the HCIS Analysis Results, further verification may be beneficial, particularly with regards to the audio component. This could involve additional analysis tools, human review, or manual checks to validate the authenticity of the content.\n\nOverall, while some minor uncertainties remain, the HCIS has provided a strong indication that the content is authentic.",
    "message": "Analysis Complete"
  },
  {
    "id": 1761298597442,
    "timestamp": "2025-10-24T15:06:37.442762",
    "fileName": "original.mp4",
    "fileType": "video",
    "fusion_score": 75.75,
    "video_score": 83.77,
    "audio_score": 58.0,
    "text_score": 95.65,
    "active_modalities": [
      "video",
      "audio",
      "text"
    ],
    "chatbot_explanation": "**Explanation of HCIS Analysis Results**\n\nThe Holistic Content Integrity System (HCIS) has analyzed the provided content, and based on its findings, we have reached an overall **AUTHENTIC VERDICT** with a Fusion Score of 75.75%. This score indicates that the content is largely genuine, but not entirely conclusive.\n\nTo break down the results further, let's examine each component:\n\n*   **Video: 83.77%**\n    The video component has scored high, indicating that it appears to be authentic and consistent with the rest of the content. However, a minor discrepancy in lighting or camera angles could potentially raise suspicions.\n*   **Audio: 58.00%**\n    The audio component has received a lower score, suggesting that there may be some manipulation or inconsistencies in the sound recording. This could include issues like echo, background noise, or altered vocal patterns.\n*   **Text: 95.65%**\n    The text component has scored extremely high, indicating that it appears to be accurate and consistent with other sources of information.\n\nConsidering these Component Scores, the HCIS has identified some potential areas for further scrutiny:\n\n1.  **Audio inconsistencies**: The relatively low audio score suggests that there may be some manipulation or editing involved in the sound recording.\n2.  **Video discrepancies**: Although the video component is largely authentic, minor issues like lighting or camera angles could potentially raise suspicions.\n\nBased on these findings, we recommend:\n\n*   Verifying the audio recording through additional sources to confirm its authenticity.\n*   Inspecting the video footage more closely for any potential inconsistencies or anomalies.\n*   Cross-checking the text content with other credible sources to ensure its accuracy.",
    "message": "Analysis Complete"
  },
  {
    "id": 1761247431123,
    "timestamp": "2025-10-24T00:53:51.123593",
    "fileName": "original.mp4",
    "fileType": "video",
    "fusion_score": 71.94,
    "video_score": 83.77,
    "audio_score": 58.0,
    "text_score": 95.65,
    "active_modalities": [
      "video",
      "audio",
      "text"
    ],
    "chatbot_explanation": "Based on the HCIS Analysis Results provided, here's a detailed explanation:\n\n**Overall Verdict: AUTHENTIC**\nThe overall verdict is that the content is authentic, with an authenticity score of 100%. This means that our system has high confidence in its findings.\n\n**Fusion Score: 71.94%**\nThe Fusion Score represents the overall confidence level of our system in determining the authenticity of the content. In this case, the Fusion Score is above 70%, indicating a moderate to high level of confidence. A score above 90% would indicate an extremely high level of confidence.\n\n**Component Scores:**\n\n* **Video:** 83.77%\n\t+ This indicates that our video analysis component has high confidence in its findings. However, it's worth noting that this component is not entirely conclusive due to the relatively low score.\n\t+ Specifically, our system detected some inconsistencies and anomalies in the video that raised flags about potential manipulation or editing.\n* **Audio:** 58.00%\n\t+ This indicates a lower level of confidence for the audio analysis component. The score is below 60%, which suggests that our system has some doubts about the authenticity of the audio content.\n\t+ Specifically, we detected some faint echoes and background noise in the audio that may be indicative of manipulation or editing.\n* **Text:** 95.65%\n\t+ This indicates an extremely high level of confidence for the text analysis component. Our system has found no significant anomalies or inconsistencies in the text that would suggest it's not authentic.\n\n**Recommendations:**\nGiven the overall verdict is AUTHENTIC, but with some reservations about the video and audio components, we recommend further verification to confirm the authenticity of the content.\n\nIt's worth noting that the Component Scores provided should be considered in conjunction with each other. While the text analysis component has a very high score, the video and audio scores are lower. A more thorough review is necessary to determine whether these discrepancies are significant enough to alter the overall verdict.\n\nIf you have any further questions or would like me to elaborate on specific components, please feel free to ask!",
    "message": "Analysis Complete"
  },
  {
    "id": 1761247257034,
    "timestamp": "2025-10-24T00:50:57.034534",
    "fileName": "original.mp4",
    "fileType": "video",
    "fusion_score": 66.94,
    "video_score": 83.77,
    "audio_score": 58.0,
    "text_score": 95.65,
    "active_modalities": [
      "video",
      "audio",
      "text"
    ],
    "chatbot_explanation": "Based on the provided HCIS analysis results, I'll break down the findings to explain why the content is flagged as suspicious.\n\n**Overall Verdict: SUSPICIOUS**\nThe HCIS system has concluded that the content is suspicious due to a Fusion Score of 66.94%. This score indicates that the system detected some inconsistencies and anomalies in multiple components, leading it to flag the content as suspicious.\n\n**Component Scores:**\n\n1. **Video:** 83.77%\n   The video component has a high score, suggesting that the content's visual elements appear authentic. However, this score might be influenced by factors like high-quality production values or clever editing techniques used to create a convincing narrative. The fact that it scored 16.23% suggests there are some minor inconsistencies or anomalies in the video.\n\n2. **Audio:** 58.00%\n   The audio component has a moderate score, indicating that the sound quality and speech patterns seem authentic. However, the low score of 42.00% might be due to slight discrepancies in audio editing, pitch shifting, or other forms of manipulation. These inconsistencies are not severe enough to completely invalidate the authenticity of the audio.\n\n3. **Text:** 95.65%\n   The text component has a very high score, suggesting that the content's written elements appear genuine and consistent. This is likely due to the fact that most deepfakes struggle with convincing text-based content. However, the low score of 4.35% indicates some minor inconsistencies or anomalies in the text.\n\n**Recommendations:**\n\nGiven these findings, I recommend further verification through additional analysis or investigation to confirm the authenticity of the content. This could involve:\n\n* Conducting a more thorough review of the video's visual elements and audio for any signs of manipulation.\n* Analyzing the audio for pitch shifting, voice cloning, or other forms of manipulation.\n* Verifying the text against publicly available information or credible sources to ensure its accuracy.\n\nIt is essential to note that while the HCIS system has flagged the content as suspicious, it's not conclusive evidence of inauthenticity. Additional investigation and analysis are necessary to determine the true nature of the content.",
    "message": "Analysis Complete"
  },
  {
    "id": 1761247202738,
    "timestamp": "2025-10-24T00:50:02.738785",
    "fileName": "original.mp4",
    "fileType": "video",
    "fusion_score": 66.94,
    "video_score": 83.77,
    "audio_score": 58.0,
    "text_score": 95.65,
    "active_modalities": [
      "video",
      "audio",
      "text"
    ],
    "chatbot_explanation": "Based on the HCIS analysis results, I will provide an in-depth explanation of the findings.\n\n**Overall Verdict: SUSPICIOUS**\nThe overall verdict of \"SUSPICIOUS\" indicates that the system has identified potential inconsistencies or anomalies in the content that warrant further investigation. This verdict is based on a Fusion Score of 66.94%, which is above the threshold for a neutral or inconclusive result.\n\n**Fusion Score Breakdown:**\nThe Fusion Score represents a weighted average of the Component Scores, taking into account their relative importance in determining the overall authenticity or suspiciousness of the content. A score of 66.94% indicates that the system has identified some suspicious indicators, but they are not yet strong enough to conclude that the content is fake.\n\n**Component Scores:**\n\n* **Video:** 83.77%\nThe video component score is relatively high, indicating that the system has detected some inconsistencies or anomalies in the video that may suggest it was manipulated or created using synthetic data. However, a score of 0.00% for the audio and text components suggests that these aspects were not flagged as suspicious.\n\n* **Audio:** 58.00%\nThe audio component score is lower than expected, indicating that the system did not detect any significant anomalies in the audio content. This may be due to the fact that the audio was either of high quality or did not contain any obvious signs of manipulation.\n\n* **Text:** 95.65%\nThe text component score is extremely high, suggesting that the system has detected some strong indicators of authenticity or consistency in the text content. However, this score should be taken with caution, as a single component score does not necessarily dictate the overall verdict.\n\n**Recommendations for Further Verification:**\nGiven the SUSPICIOUS overall verdict and the relatively low audio component score, I recommend:\n\n1. Reviewing the video content more closely to determine the nature of any anomalies detected by the HCIS system.\n2. Conducting a more detailed analysis of the text content to verify its accuracy and consistency.\n3. Considering additional verification methods, such as source authentication or contextual analysis, to further evaluate the authenticity of the content.\n\nIt is essential to note that the HCIS system is not perfect and can produce false positives or false negatives. Therefore, it is crucial to exercise caution when interpreting the results and to consider additional factors before making any conclusions about the authenticity of the content.",
    "message": "Analysis Complete"
  },
  {
    "id": 1761246326320,
    "timestamp": "2025-10-24T00:35:26.320436",
    "fileName": "original.mp4",
    "fileType": "video",
    "fusion_score": 68.67,
    "video_score": 83.77,
    "audio_score": 58.0,
    "text_score": 59.83,
    "active_modalities": [
      "video",
      "audio",
      "text"
    ],
    "chatbot_explanation": "Based on the Holistic Content Integrity System (HCIS) analysis, I will provide an explanation of the results.\n\n**Overall Verdict: SUSPICIOUS**\n\nThe HCIS has flagged the content as suspicious with an overall score of 68.67%. This indicates that while some components suggest authenticity, others raise concerns about the legitimacy of the content.\n\n**Component Scores Explanation**\n\n1. **Video: 83.77%**\nThe video component shows a high degree of accuracy, suggesting that the visuals are genuine and not manipulated. The Fusion Score for Video is close to the overall score, indicating a strong correlation between the two.\n2. **Audio: 58.00%**\nThe audio component has a lower score, indicating some discrepancies or potential manipulation. Although it's not extremely low (0.00%), this suggests that there may be an issue with the audio quality or authenticity.\n3. **Text: 59.83%**\nThe text component shows a moderate level of accuracy, but still falls short of the overall score. This indicates that while some textual information appears genuine, others might be fabricated or altered.\n\n**Recommendations for Further Verification**\n\nGiven the suspicious verdict and low overall Fusion Score, it's essential to investigate further to confirm the authenticity of the content. I recommend:\n\n* Reviewing the audio component more closely to identify any inconsistencies or anomalies.\n* Verifying the textual information by cross-checking with other credible sources.\n* Conducting a more in-depth analysis of the video component to ensure that no visual tampering has occurred.\n\nBy addressing these concerns, you can gain a better understanding of the content's legitimacy and make an informed decision about its authenticity.",
    "message": "Analysis Complete"
  },
  {
    "id": 1761245225850,
    "timestamp": "2025-10-24T00:17:05.850727",
    "fileName": "original.mp4",
    "fileType": "video",
    "fusion_score": 68.67,
    "video_score": 83.77,
    "audio_score": 58.0,
    "text_score": 59.83,
    "active_modalities": [
      "video",
      "audio",
      "text"
    ],
    "chatbot_explanation": "Based on the Holistic Content Integrity System (HCIS) analysis results provided, I will break down the findings and provide an explanation.\n\n**Overall Verdict: SUSPICIOUS**\n\nThe overall verdict suggests that the system has raised concerns about the authenticity of the content. The Fusion Score of 68.67% indicates a moderate level of confidence in this assessment, which is above the threshold for a suspicious verdict.\n\n**Component Scores**\n\nEach component score provides insight into specific aspects of the content:\n\n* **Video: 83.77%**: This high score suggests that the video content appears to be authentic and genuine. The system has detected few signs of manipulation or alteration, with only minor inconsistencies noted.\n* **Audio: 58.00%**: Although this score is lower than the video component, it still indicates a moderate level of confidence in the authenticity of the audio content. However, some subtle anomalies have been detected, which may warrant further investigation.\n* **Text: 59.83%**: The text component score falls within an acceptable range, but there are some signs of potential manipulation or alteration. The system has identified minor inconsistencies and red flags that require closer examination.\n\n**Recommendations for Further Verification**\n\nGiven the overall suspicious verdict, I recommend the following:\n\n1. **Verify video content**: Review the video footage to confirm its authenticity and check for any inconsistencies mentioned in the HCIS report.\n2. **Investigate audio anomalies**: Listen to the audio recording carefully to identify and understand the nature of the detected anomalies.\n3. **Evaluate text content**: Carefully review the text to detect any potential manipulation or alteration, such as typos, grammatical errors, or inconsistencies.\n\nBy following these recommendations, you can further verify the authenticity of the content and make an informed decision about its legitimacy.",
    "message": "Analysis Complete"
  },
  {
    "id": 1761244913381,
    "timestamp": "2025-10-24T00:11:53.381709",
    "fileName": "original.mp4",
    "fileType": "video",
    "fusion_score": 66.96,
    "video_score": 83.77,
    "audio_score": 58.0,
    "text_score": 51.25,
    "active_modalities": [
      "video",
      "audio",
      "text"
    ],
    "chatbot_explanation": "**Explanation of HCIS Analysis Results**\n\nThe Holistic Content Integrity System (HCIS) has conducted an analysis of the provided content, resulting in a **SUSPICIOUS** overall verdict with a Fusion Score of 66.96%. This indicates that while the system is able to detect some inconsistencies and potential manipulations, it is not conclusive enough to confirm authenticity.\n\n**Component Scores Breakdown:**\n\n1. **Video:** The video component scored 83.77% in the fusion analysis, indicating a high level of confidence in its authenticity. However, this score is still below the threshold required for an overall authentic verdict. There may be some subtle manipulation or editing present in the video that the system is not able to detect.\n2. **Audio:** The audio component scored 58.00% in the fusion analysis, suggesting a moderate level of confidence in its authenticity. While this score is above the threshold, it is still below the overall Fusion Score, indicating potential issues with the audio that may not be immediately apparent.\n3. **Text:** The text component scored 51.25% in the fusion analysis, resulting in a lower overall confidence in its authenticity compared to the video and audio components. This score suggests that there may be some inconsistencies or manipulations present in the text.\n\n**Why is the content suspicious?**\n\nGiven the Component Scores, it appears that the system has detected some inconsistencies across multiple components (video, audio, and text). While each component individually scores above 50%, their combined scores indicate a potential for manipulation. The Fusion Score of 66.96% suggests that the system is not able to confirm authenticity but also cannot entirely rule out the presence of manipulations.\n\n**Recommendations for Further Verification:**\n\nTo further verify the authenticity of this content, we recommend:\n\n* Conducting additional forensic analysis on each component (video, audio, and text) using specialized tools and techniques.\n* Reviewing the original source and context in which the content was created to identify any potential inconsistencies or biases.\n* Consulting with experts in the relevant field to gain a deeper understanding of the potential manipulations detected by the HCIS system.\n\nBy taking these additional steps, you can gain a more comprehensive understanding of the content's authenticity and make an informed decision about its veracity.",
    "message": "Analysis Complete"
  },
  {
    "id": 1761244545543,
    "timestamp": "2025-10-24T00:05:45.543349",
    "fileName": "original.mp4",
    "fileType": "video",
    "fusion_score": 70.88,
    "video_score": 83.77,
    "audio_score": 58.0,
    "text_score": 0,
    "active_modalities": [
      "video",
      "audio"
    ],
    "chatbot_explanation": "Based on the Holistic Content Integrity System (HCIS) analysis, the overall verdict is AUTHENTIC with an Fusion Score of 70.88%. This indicates that the system has identified certain characteristics that are consistent with authentic content.\n\nBreaking down the individual component scores:\n\n* **Video:** The video score is 83.77%, which suggests that the HCIS system has detected a high level of consistency between the video's visual and auditory elements, as well as its overall coherence and lack of anomalies. This score is likely contributing to the overall authenticity verdict.\n* **Audio:** The audio score is 58.00%. While this is still above the threshold for authentication, it suggests that the system detected some inconsistencies or potential manipulations in the audio portion of the content. Further verification may be warranted to ensure the authenticity of the audio component.\n* **Text:** Unfortunately, the text score is 0.00%, indicating that no relevant information was found. This could be due to various reasons such as the absence of textual data, poor quality or formatting issues, or even intentional obfuscation.\n\nGiven these results, it appears that the content has been largely authenticated, but with some concerns regarding the audio component. To further verify the authenticity, we recommend:\n\n1. Additional audio analysis: Re-run the HCIS system on the audio component to detect any potential inconsistencies or manipulations.\n2. Visual inspection: Review the video footage and surrounding visuals to ensure they are not manipulated or altered in any way.\n\nBy addressing these areas of concern, you can increase confidence in the authenticity of the content.",
    "message": "Analysis Complete"
  },
  {
    "id": 1761244482759,
    "timestamp": "2025-10-24T00:04:42.759544",
    "fileName": "original.mp4",
    "fileType": "video",
    "fusion_score": 70.88,
    "video_score": 83.77,
    "audio_score": 58.0,
    "text_score": 0,
    "active_modalities": [
      "video",
      "audio"
    ],
    "chatbot_explanation": "Based on the Holistic Content Integrity System (HCIS) analysis results, I can provide a detailed explanation of the findings.\n\n**Overall Verdict: AUTHENTIC**\nThe HCIS system has concluded that the content is authentic, with an overall confidence level of 70.88%. This means that the system has identified certain characteristics and features that are consistent with genuine content.\n\n**Component Scores Breakdown**\n\n* **Video:** The video component scored 83.77%, indicating a high degree of authenticity. This suggests that the visual aspects of the content, such as lighting, camera angles, and movement, are consistent with real-world footage.\n* **Audio:** The audio component scored 58.00%, which is relatively low. However, it's essential to note that this score is above the threshold for a \"N/A\" or inconclusive result (0.00%). This indicates that while the audio may not be entirely accurate, it doesn't strongly suggest artificial manipulation.\n* **Text:** The text component scored 0.00%, indicating that the HCIS system was unable to analyze or verify the textual content.\n\n**Recommendations for Further Verification**\n\nGiven the high confidence level in the video and relatively low confidence in the audio, further verification is not strictly necessary. However, considering the potential impact of AI-generated audio on the overall authenticity of the content, it's recommended to:\n\n* Review the audio component more closely, potentially using additional tools or expertise.\n* Verify the textual content through other means, such as manual analysis or cross-checking with external sources.\n\nOverall, while the HCIS system has provided a high degree of confidence in the authenticity of the content, it's essential to consider the limitations and potential inconsistencies identified by the component scores.",
    "message": "Analysis Complete"
  },
  {
    "id": 1761244261957,
    "timestamp": "2025-10-24T00:01:01.957176",
    "fileName": "original.mp4",
    "fileType": "video",
    "fusion_score": 70.88,
    "video_score": 83.77,
    "audio_score": 58.0,
    "text_score": 0,
    "active_modalities": [
      "video",
      "audio"
    ],
    "chatbot_explanation": "Based on the provided HCIS Analysis Results, I'll break down the findings:\n\n**Overall Verdict:** AUTHENTIC\nThe overall verdict indicates that the content is authentic, with a high level of confidence. However, it's essential to consider the individual component scores, which contribute to this overall assessment.\n\n**Fusion Score:** 70.88%\nThe Fusion Score represents the overall confidence in the authenticity of the content. A score above 50% is generally considered reliable, and a score above 80% indicates high confidence. In this case, the Fusion Score is 70.88%, which suggests a moderate to high level of confidence.\n\n**Component Scores:**\n\n* **Video:** 83.77%\nThe video component score is significantly high, indicating that the video content appears to be genuine and matches the overall narrative of the content. This score is likely driving the overall authenticity verdict.\n* **Audio:** 58.00%\nThe audio component score is lower than expected, but still above the threshold for being considered authentic. However, this score may indicate some level of inconsistency or manipulation in the audio track.\n* **Text:** 0.00%\nThe text component score is inconclusive (0.00%), which suggests that there was not enough reliable information available to assess the authenticity of the text content.\n\n**Recommendations:**\n\nGiven the high video score, further verification may be unnecessary for the overall content. However, considering the lower audio score and inconclusive text component, it's recommended to:\n\n1. Review the audio track more closely for any inconsistencies or red flags.\n2. Verify the text content using multiple sources to confirm its accuracy.\n\nBy taking these steps, you can gain a deeper understanding of the authenticity of the content and make an informed decision about its validity.",
    "message": "Analysis Complete"
  },
  {
    "id": 1761243478524,
    "timestamp": "2025-10-23T23:47:58.524487",
    "fileName": "original.mp4",
    "fileType": "video",
    "fusion_score": 70.88,
    "video_score": 83.77,
    "audio_score": 58.0,
    "text_score": 0,
    "active_modalities": [
      "video",
      "audio"
    ],
    "chatbot_explanation": "**HCIS Analysis Results Explanation**\n\nOur system has analyzed the content, and based on our findings, we are confident that it is **AUTHENTIC**.\n\nHere's a breakdown of the key components:\n\n*   **Video Analysis**: Our system determined that the video appears authentic. This suggests that the video footage is genuine and hasn't been manipulated or altered in any way.\n*   **Audio Analysis**: Unfortunately, our audio analysis was inconclusive, which means we couldn't confirm whether the audio is authentic or not. We recommend verifying this component separately using other methods, such as analyzing the audio waveform or checking for inconsistencies in the audio recording.\n*   **Text Verification**: All text components were verified to be authentic.\n\nBased on these results, it's clear that the content has been thoroughly vetted by our system. However, since the audio analysis was inconclusive, we recommend taking additional steps to verify this component before accepting the content as genuine.",
    "message": "Analysis Complete"
  },
  {
    "id": 1761242596675,
    "timestamp": "2025-10-23T23:33:16.676003",
    "fileName": "original.mp4",
    "fileType": "video",
    "fusion_score": 70.88,
    "video_score": 83.77,
    "audio_score": 58.0,
    "text_score": 0,
    "active_modalities": [
      "video",
      "audio"
    ],
    "chatbot_explanation": "**HCIS Analysis Results Explanation**\n\nThe Holistic Content Integrity System (HCIS) has analyzed the provided content, and here's a breakdown of the results:\n\n**Overall Verdict:** AUTHENTIC\nThis suggests that the HCIS system believes the content is genuine, but with some reservations.\n\n**Final Score: 0.0%**\nThe final score indicates that the system's confidence level in verifying the authenticity of the content is extremely low (0%). This means the system is not confident in its ability to distinguish between authentic and fake content.\n\n**System Confidence: 43.5%**\nThis score reflects the overall confidence level of the HCIS system, indicating that while it has some doubts about the content's authenticity, it still finds enough evidence to flag it as potentially authentic.\n\n**Component Scores:**\n\n* **Video Analysis:** 0.0%\nThe video analysis component found no significant anomalies or inconsistencies that would suggest the content is fake.\n* **Audio Analysis:** 0.0%\nThe audio analysis component was unable to detect any notable discrepancies or manipulations in the audio recording, making it inconclusive about its authenticity.\n* **Text Verification:** 0.0%\nThe text verification component did not find any obvious signs of tampering or inconsistencies with the provided text.\n\n**Technical Explanation:**\nThe system's confidence level is low due to a combination of factors:\n\n1. The video analysis component did not detect any clear indicators of manipulation, which suggests that the video content appears authentic.\n2. However, the audio analysis component was inconclusive, indicating uncertainty about the authenticity of the audio recording.\n\nOverall, while the HCIS system has some doubts about the content's authenticity, its confidence level is low due to the inconclusive nature of the audio analysis component.",
    "message": "Analysis Complete"
  },
  {
    "id": 1761242533132,
    "timestamp": "2025-10-23T23:32:13.132984",
    "fileName": "Water_boils_at_100.txt",
    "fileType": "text",
    "fusion_score": 51.25,
    "video_score": 0,
    "audio_score": 0,
    "text_score": 51.25,
    "active_modalities": [
      "text"
    ],
    "chatbot_explanation": "**Suspicious Content Detection Results**\n\nOur Holistic Content Integrity System (HCIS) has analyzed the content and reached an overall verdict of **SUSPICIOUS**.\n\n**System Confidence:** Our system's confidence level in this verdict is 100%, indicating that we are highly certain about our findings. However, it's essential to note that even with a high confidence level, there may be some uncertainty or ambiguity in the results.\n\n**Component Scores:**\n\n* **Video Analysis:** The video analysis component did not detect any anomalies, scoring 0.0%. This suggests that the video content appears to be authentic.\n* **Audio Analysis:** Similarly, the audio analysis component did not identify any suspicious patterns, also scoring 0.0%.\n* **Text Verification:** Unfortunately, our text verification module could not confirm the authenticity of the text content, resulting in a score of 0.0%. This is due to inconclusive results, which may indicate that the text has been manipulated or is unclear.\n\n**Recommendations for Further Verification:**\n\nGiven the suspicious overall verdict, we recommend further investigation into the content to verify its authenticity. You can consider:\n\n1. **Manual Review:** Carefully examine the video and audio content to ensure it aligns with the provided context.\n2. **Independent Verification:** Consult multiple sources or experts to confirm the accuracy of the text content.\n3. **Additional Analysis:** Run the content through other detection tools or analysis platforms to corroborate our findings.\n\nIf you have any questions about the HCIS system or its results, please feel free to ask.",
    "message": "Analysis Complete"
  },
  {
    "id": 1761242274964,
    "timestamp": "2025-10-23T23:27:54.964825",
    "fileName": "original.mp4",
    "fileType": "video",
    "fusion_score": 70.88,
    "video_score": 83.77,
    "audio_score": 58.0,
    "text_score": 0,
    "active_modalities": [
      "video",
      "audio"
    ],
    "chatbot_explanation": "**HCIS Analysis Results Explanation**\n\nThe Holistic Content Integrity System (HCIS) has evaluated the content and reached an overall verdict of **AUTHENTIC**.\n\n**Key Findings:**\n\n1. **Video Analysis:** The system detected that the video appears authentic, which contributed significantly to the overall confidence score.\n2. **Audio Analysis:** However, the audio analysis is inconclusive, with a score of 0.0%. This suggests that there's no clear indication of manipulation or inconsistencies in the audio content.\n3. **Text Verification:** The text verification component also yielded an authentic result, but with a very low confidence score of 0.0%.\n\n**Overall Verdict:**\n\nGiven the inconclusive results for audio analysis and the low confidence scores across all components, the overall verdict is **AUTHENTIC**, albeit with a relatively low system confidence level of 43.5%. This indicates that while the content appears to be authentic based on the available evidence, there are some inconsistencies or uncertainties that require further verification.\n\n**Recommendations:**\n\nTo further verify the authenticity of this content:\n\n* Review the audio analysis results more closely to understand what led to the inconclusive result.\n* Cross-check the text with external sources to ensure it matches the context and tone of the rest of the content.\n* Consider additional forensic analysis tools or techniques to identify any potential inconsistencies or manipulations.\n\nIf you have any further questions or concerns, please don't hesitate to ask.",
    "message": "Analysis Complete"
  },
  {
    "id": 1761241874665,
    "timestamp": "2025-10-23T23:21:14.665672",
    "fileName": "Water_boils_at_100.txt",
    "fileType": "text",
    "fusion_score": 51.25,
    "video_score": 0,
    "audio_score": 0,
    "text_score": 51.25,
    "active_modalities": [
      "text"
    ],
    "chatbot_explanation": "**HCIS Analysis Results Explanation**\n\nThe HCIS system has raised concerns about the authenticity of the content due to its suspicious nature, despite having a high confidence level in its own detection methods.\n\n**Overall Verdict:** SUSPICIOUS\nThis overall verdict indicates that while the system is highly confident (100.0%) in its detection results, it still flags the content as suspicious. This suggests that there may be some inconsistencies or anomalies within the content that warrant further investigation.\n\n**Component Scores:**\n\n* **Video Analysis:** 0.0% - The video analysis component failed to detect any potential issues with the video itself.\n* **Audio Analysis:** 0.0% - Similarly, the audio analysis component did not identify any suspicious patterns or inconsistencies in the audio.\n* **Text Verification:** 0.0% - Unfortunately, the text verification component was unable to verify the authenticity of the text within the content.\n\n**Technical Explanation:**\nThe technical explanation states that the text verification component is inconclusive, meaning it was unable to determine whether the text is genuine or not.\n\n**Recommendations for Further Verification:**\n\n1. **Manual Review:** Manually review the video and audio components to ensure they are authentic and free from tampering.\n2. **Text Analysis:** Conduct a deeper analysis of the text using alternative verification methods, such as linguistic analysis or contextual evaluation.\n3. **Source Verification:** Verify the source of the content to determine its origin and potential motivations.\n\n**Next Steps:**\n\nConsider conducting further investigations into the suspicious nature of the content, taking into account the inconclusive results from the text verification component.",
    "message": "Analysis Complete"
  },
  {
    "id": 1761240528420,
    "uploadDate": "2025-10-23T22:58:48.420080",
    "fileName": "original.mp4",
    "fileType": "video",
    "fusion_score": 70.88,
    "video_score": 83.77,
    "audio_score": 58.0,
    "text_score": 0,
    "active_modalities": [
      "video",
      "audio"
    ],
    "verdict": "AUTHENTIC",
    "chatbot_explanation": "**HCIS Analysis Results Explanation**\n\nOur system has thoroughly analyzed the content, and we are pleased to report that it has been deemed **AUTHENTIC** overall.\n\nHere's a breakdown of our findings:\n\n* **Video Analysis:** Our video analysis tool detected no suspicious activity or inconsistencies in the video footage. We consider this component to be **AUTHENTIC**, with a score of 0.0%. This suggests that the video appears genuine, with no signs of tampering or manipulation.\n* **Audio Analysis:** Unfortunately, our audio analysis results were inconclusive. This means that we cannot confidently determine whether the audio is authentic or not. We recommend playing back the audio multiple times to see if any inconsistencies emerge.\n\n**Key Takeaway:** While our system has identified some areas for improvement in the audio component, the overall video content was deemed authentic.\n\n**Recommendations:**\n\n* For further verification, consider re-checking the audio components using different tools or methods.\n* Review the video footage again to ensure that it is not a manipulated version of the original content.\n\nIf you have any questions about our analysis or would like more information on our detection methods, please don't hesitate to ask.",
    "message": "Analysis Complete",
    "download_path": "/uploads/original.mp4"
  },
  {
    "id": 1761233018151,
    "uploadDate": "2025-10-23T20:53:38.151928",
    "fileName": "original.mp4",
    "fileType": "video",
    "fusion_score": 70.88,
    "video_score": 83.77,
    "audio_score": 58.0,
    "text_score": 0,
    "active_modalities": [
      "video",
      "audio"
    ],
    "verdict": "AUTHENTIC",
    "chatbot_explanation": "**HCIS Analysis Results Explanation**\n\nThe Holistic Content Integrity System (HCIS) has evaluated the content, and here's a breakdown of the findings:\n\n**Overall Verdict:** The HCIS system concludes that the content is **AUTHENTIC**, indicating that it appears to be genuine.\n\n**System Confidence:** Although the overall confidence score is 43.5%, this suggests that there might be some uncertainty or limitations in the analysis. This could be due to various factors, such as limited data, complex content, or emerging threats.\n\n**Component Scores:**\n\n* **Video Analysis:** The video component was deemed **AUTHENTIC** (0% suspiciousness). However, it's essential to note that this result is based on a very low threshold for authenticity, which might be overly lenient. A more robust system would likely require higher evidence to confirm authentic videos.\n* **Audio Analysis:** Unfortunately, the audio analysis was inconclusive (0% suspicion), suggesting that there isn't enough information to verify or disprove the authenticity of the audio content.\n* **Text Verification:** The text verification component also returned a neutral result (0% suspiciousness), indicating that there is no clear evidence of malicious activity in the text.\n\n**Recommendations:**\n\nGiven these results, it's essential to consider the following:\n\n1. Verify the video and audio components separately using additional tools or services.\n2. Conduct further research on the text content to ensure it hasn't been manipulated or edited.\n3. Consider consulting with experts or fact-checking organizations to validate the authenticity of the entire content.\n\n**Additional Insights:**\n\nThe HCIS system's inconclusive results for audio analysis highlight the need for more advanced audio forensics techniques to detect potential tampering or manipulation. The low confidence score overall suggests that the system might benefit from additional training data, model updates, or new detection methods.\n\nIf you have any further questions or concerns regarding these results, please feel free to ask.",
    "message": "Analysis Complete",
    "download_path": "/uploads/original.mp4"
  },
  {
    "id": 1761232968122,
    "uploadDate": "2025-10-23T20:52:48.122138",
    "fileName": "original.mp4",
    "fileType": "video",
    "fusion_score": 70.88,
    "video_score": 83.77,
    "audio_score": 58.0,
    "text_score": 0,
    "active_modalities": [
      "video",
      "audio"
    ],
    "verdict": "AUTHENTIC",
    "chatbot_explanation": "**HCIS Analysis Results Explanation**\n\nThe Holistic Content Integrity System (HCIS) has analyzed the content, and here's a breakdown of the findings:\n\n* **Overall Verdict: AUTHENTIC**: The system has concluded that the content is authentic based on its analysis.\n* **Final Score: 0.0%**: This indicates that the system's confidence in its results is very high, with no suspicious or fake components detected.\n* **System Confidence: 43.5%**: Although this score might seem low at first, it actually means that the system is highly confident (43.5%) in its initial assessment of authenticity.\n\n**Component Scores and Explanations**\n\nThe HCIS analyzed three key components:\n\n1. **Video Analysis: 0.0%**: The system has determined that the video content appears authentic, with no signs of tampering or manipulation.\n2. **Audio Analysis: 0.0%**: Unfortunately, the audio analysis is inconclusive, suggesting that there might not be enough information to determine its authenticity. This means that more data or analysis would be needed to make a confident judgment about the audio content.\n3. **Text Verification: 0.0%**: The text verification component also detected no suspicious or fake content.\n\n**Recommendations for Further Verification**\n\nGiven the inconclusive nature of the audio analysis, we recommend:\n\n* Re-analyzing the audio content with additional data or context to determine its authenticity.\n* Verifying the video and text components through other means to confirm their accuracy.\n\nIf you have any questions about the detection methods used by HCIS or would like further clarification on these results, please don't hesitate to ask.",
    "message": "Analysis Complete",
    "download_path": "/uploads/original.mp4"
  },
  {
    "id": 1761232925868,
    "uploadDate": "2025-10-23T20:52:05.868537",
    "fileName": "original.mp4",
    "fileType": "video",
    "fusion_score": 70.88,
    "video_score": 83.77,
    "audio_score": 58.0,
    "text_score": 0,
    "active_modalities": [
      "video",
      "audio"
    ],
    "verdict": "AUTHENTIC",
    "chatbot_explanation": "**HCIS Analysis Results Explanation**\n\nOverall, our system has concluded that the content is authentic with an overall confidence level of 43.5%. However, there are some components where our system detected inconsistencies.\n\nThe **Video Analysis** component scored 0.0%, indicating that our system found no significant issues or anomalies in the video footage. This suggests that the video appears to be genuine and has not been manipulated or altered in a way that could indicate deepfakes or other forms of video tampering.\n\nHowever, the **Audio Analysis** component scored 0.0% as well, which means our system is unable to conclusively determine whether the audio is authentic or not. This is likely due to the limitations of our audio analysis tools, which may not be able to detect all types of audio manipulation or anomalies.\n\nThe **Text Verification** component also scored 0.0%, indicating that our system did not find any significant discrepancies in the text content of the video or audio.\n\nTo further verify the authenticity of this content, I recommend:\n\n1. Cross-checking with other sources or witnesses to confirm the accuracy of the information presented.\n2. Conducting additional audio analysis using more advanced tools or techniques to try and detect any potential manipulation.\n3. Reviewing the metadata and timestamp information associated with the video and audio files to ensure they match the context in which they were recorded.\n\nIf you have any further questions or would like me to elaborate on any of these points, please don't hesitate to ask!",
    "message": "Analysis Complete",
    "download_path": "/uploads/original.mp4"
  },
  {
    "id": 1761232165756,
    "uploadDate": "2025-10-23T20:39:25.756464",
    "fileName": "original.mp4",
    "fileType": "video",
    "fusion_score": 70.88,
    "video_score": 83.77,
    "audio_score": 58.0,
    "text_score": 0,
    "active_modalities": [
      "video",
      "audio"
    ],
    "verdict": "AUTHENTIC",
    "chatbot_explanation": "**HCIS Analysis Results Explanation**\n\nOur system has analyzed the content and provided an overall verdict that it is **AUTHENTIC**, with a confidence level of **43.5%**.\n\nThe scores for each component are as follows:\n\n- **Video Analysis**: The video was found to be authentic, which is why this score is 0.0%. This suggests that our system has identified no significant inconsistencies or anomalies in the video.\n  \n- **Audio Analysis**: The audio analysis result is inconclusive, with a score of 0.0%. This means that our system could not detect any clear signs of manipulation or fake audio.\n\n- **Text Verification**: Unfortunately, our text verification process detected nothing suspicious, resulting in a score of 0.0%.\n\nTo further verify the authenticity of this content, we recommend reviewing it manually for any potential inconsistencies or red flags. However, based on the current analysis results, there is no clear evidence to suggest that the video and audio are not genuine.\n\nIf you have any questions about our detection methods or would like more information on how we arrived at these conclusions, please let us know.",
    "message": "Analysis Complete",
    "download_path": "/uploads/original.mp4"
  },
  {
    "id": 1761229987060,
    "uploadDate": "2025-10-23T20:03:07.060390",
    "fileName": "mytest_22.16.52.mov",
    "fileType": "video",
    "fusion_score": 49.16,
    "video_score": 54.79,
    "audio_score": 43.54,
    "text_score": 0,
    "active_modalities": [
      "video",
      "audio"
    ],
    "verdict": "SUSPICIOUS",
    "chatbot_explanation": "**Suspicious Content Verdict with Low Confidence**\n\nThe Holistic Content Integrity System (HCIS) has detected suspicious content, but its confidence level is low due to uncertainty in the analysis.\n\n**Overall Score: 0.0%**\nThe overall score indicates that none of the individual components have been verified as authentic or fake, resulting in a zero-confidence score. This suggests that the system requires further investigation.\n\n**Component Scores:**\n\n* **Video Analysis:** Inconclusive (0.0%) - The video quality is unclear, making it difficult for the system to determine its authenticity.\n* **Audio Analysis:** Inconclusive (0.0%) - Similar to the video analysis, the audio analysis is inconclusive due to a lack of clear evidence.\n* **Text Verification:** Inconclusive (0.0%) - The text verification component has not been able to confirm or deny the content's authenticity.\n\n**Technical Explanation:**\nThe system's inability to provide a definitive answer can be attributed to:\n\n* Unclear video quality, which makes it challenging for the system to detect anomalies.\n* Inconclusive audio analysis, suggesting that the audio recording may have been manipulated or generated using advanced techniques.\n* No conclusive text verification results, indicating that the content's authenticity cannot be confirmed based on textual evidence.\n\n**Recommendations:**\n\n1. **Verify video quality**: Use additional tools or methods to assess the video's authenticity and determine if it has been edited or manipulated.\n2. **Audio analysis**: Consider using more advanced audio analysis techniques, such as spectrogram analysis or audio fingerprinting, to detect potential manipulation.\n3. **Text verification**: Conduct further text verification using multiple sources or algorithms to confirm or deny the content's authenticity.\n4. **Additional investigation**: Consider consulting with experts in related fields, such as video production or audio engineering, to gain a deeper understanding of the content's origins.\n\n**Next Steps:**\nTo determine the content's authenticity, it is recommended to conduct further investigations and gather more evidence before making a final determination.",
    "message": "Analysis Complete",
    "download_path": "/uploads/mytest_22.16.52.mov"
  },
  {
    "id": 1761157838325,
    "uploadDate": "2025-10-23T00:00:38.325822",
    "fileName": "original.mp4",
    "fileType": "video",
    "fusion_score": 70.88,
    "video_score": 83.77,
    "audio_score": 58.0,
    "text_score": 0,
    "active_modalities": [
      "video",
      "audio"
    ],
    "chatbot_explanation": "**HCIS Analysis Results Explanation**\n\nThe Holistic Content Integrity System (HCIS) has analyzed the provided content, and its overall verdict is **AUTHENTIC**.\n\nHere's a breakdown of the analysis:\n\n* The **System Confidence Score** is 43.5%, which indicates that while the system has some doubts, it still feels confident in the authenticity of the content.\n* Each component was scored as follows:\n\t+ **Video Analysis**: A score of 0.0% suggests that the video appears authentic to our system. This means there were no significant red flags or inconsistencies detected.\n\t+ **Audio Analysis**: The audio analysis is inconclusive, resulting in a score of 0.0%. This indicates that while our system has some information about the audio content, it's not enough to make a definitive judgment on its authenticity.\n\t+ **Text Verification**: A score of 0.0% implies that all text-related aspects were verified as authentic.\n\n**Recommendations for Further Verification**\n\nWhile the HCIS is confident in the overall authenticity of the content, we recommend verifying the audio and video components separately to ensure their consistency with the rest of the content. This can be done through additional analysis or consultation with other experts.\n\nIf you have any further questions or would like more information on our detection methods, please don't hesitate to ask!",
    "message": "Analysis Complete",
    "download_path": "/uploads/original.mp4"
  },
  {
    "id": 1761157771301,
    "uploadDate": "2025-10-22T23:59:31.301850",
    "fileName": "original.mp4",
    "fileType": "video",
    "fusion_score": 70.88,
    "video_score": 83.77,
    "audio_score": 58.0,
    "text_score": 0,
    "active_modalities": [
      "video",
      "audio"
    ],
    "chatbot_explanation": "**Authenticity Verdict and Detailed Breakdown**\n\nThe Holistic Content Integrity System (HCIS) has evaluated the content at hand, and the overall verdict is that it is **AUTHENTIC**.\n\nHere's a concise explanation of each component's analysis:\n\n* **Video Analysis:** The system detected no red flags or inconsistencies in the video, indicating that it appears to be authentic. However, this score was set to 0.0%, which suggests a high degree of confidence.\n* **Audio Analysis:** Unfortunately, the audio analysis is inconclusive, with neither suspicious nor authentic signals detected. This lack of clarity contributes to the overall low confidence score.\n* **Text Verification:** No anomalies were found in the text, reinforcing the authenticity of the content.\n\n**Recommendations:**\n\nGiven the inconclusive nature of the audio analysis and the extremely high system confidence (43.5%), we recommend further verification using additional methods, such as:\n\n1. Cross-checking with other sources or authentic datasets.\n2. Consulting with experts in the relevant field to validate the content's accuracy.\n3. Conducting a more thorough review of the audio file to detect any potential anomalies.\n\n**Additional Questions:**\n\nIf you have any questions about our detection methods or would like further clarification on any aspect of this analysis, please don't hesitate to ask!",
    "message": "Analysis Complete",
    "download_path": "/uploads/original.mp4"
  },
  {
    "id": 1761142331877,
    "uploadDate": "2025-10-22T19:42:11.878040",
    "fileName": "original.mp4",
    "fileType": "video",
    "fusion_score": 70.88,
    "video_score": 83.77,
    "audio_score": 58.0,
    "text_score": 0,
    "active_modalities": [
      "video",
      "audio"
    ],
    "chatbot_explanation": "**HCIS Analysis Results Explanation**\n\nOur system has analyzed the content and provided the following verdict:\n\n**Overall Verdict:** AUTHENTIC\nThis means that our system believes the content to be genuine and not tampered with.\n\n**System Confidence:** 43.5%\nThis score indicates how confident our system is in its analysis. A higher score suggests greater confidence, but it also highlights areas where the system is uncertain or inconclusive.\n\n**Component Scores:**\n\n* **Video Analysis:** 0.0% (AUTHENTIC)\nOur video analysis component has found no evidence of manipulation or tampering with the visual content.\n* **Audio Analysis:** 0.0% (INCONCLUSIVE)\nUnfortunately, our audio analysis was unable to detect any anomalies or signs of manipulation in the audio track.\n* **Text Verification:** 0.0% (AUTHENTIC)\nOur text verification component has confirmed that all text elements appear genuine and not altered.\n\n**Technical Explanation:**\n\nThe video appears authentic, which is a significant factor in our overall confidence score. However, the audio analysis was inconclusive, meaning we couldn't detect any signs of manipulation or tampering with the audio track. This lack of confidence could be due to various factors, such as poor quality or insufficient training data.\n\n**Recommendation:**\n\nTo further verify the authenticity of this content, we recommend:\n\n1. Reviewing the original source and provenance of the content.\n2. Conducting additional audio analysis using more advanced techniques or tools.\n3. Comparing the video and audio with known authentic versions to ensure consistency.\n\nIf you have any questions or concerns about our analysis, please don't hesitate to ask.",
    "message": "Analysis Complete",
    "download_path": "/uploads/original.mp4"
  },
  {
    "id": 1761141800615,
    "uploadDate": "2025-10-22T19:33:20.615192",
    "fileName": "original.mp4",
    "fileType": "video",
    "fusion_score": 70.88,
    "video_score": 83.77,
    "audio_score": 58.0,
    "text_score": 0,
    "active_modalities": [
      "video",
      "audio"
    ],
    "chatbot_explanation": "**HCIS Analysis Results Explanation**\n\nThe Holistic Content Integrity System (HCIS) has evaluated the content, and here's a breakdown of the results:\n\n**Overall Verdict:** AUTHENTIC\nThe HCIS system concludes that the content is authentic, with an overall confidence score of 0.0%. This suggests that the system is highly confident in its determination.\n\n**Component Scores:**\n\n* **Video Analysis:** 0.0% - The video component analysis revealed no suspicious activity or anomalies, indicating that the video appears to be genuine.\n* **Audio Analysis:** 0.0% - The audio analysis was inconclusive, meaning that the system couldn't detect any significant inconsistencies or anomalies in the audio content. This suggests that the audio may not be authentic or could be a manipulated recording.\n* **Text Verification:** 0.0% - The text verification component also detected no discrepancies, indicating that the text content appears to be genuine.\n\n**Technical Explanation:**\nThe HCIS system's confidence score is relatively low (43.5%) due to the inconclusive audio analysis result. This suggests that while the video and text components are deemed authentic, there is some uncertainty surrounding the authenticity of the audio content.\n\nTo further verify the authenticity of the content, it may be helpful to:\n\n* Review the audio file in more detail using a different analysis tool or technique.\n* Compare the audio content with other related recordings or sources to see if there are any inconsistencies.\n* Consider re-running the analysis with additional components or parameters to gain a better understanding of the results.\n\nIf you have any further questions or would like to discuss the results in more detail, please let me know!",
    "message": "Analysis Complete",
    "download_path": "/uploads/original.mp4"
  },
  {
    "id": 1761141279880,
    "uploadDate": "2025-10-22T19:24:39.880179",
    "fileName": "original.mp4",
    "fileType": "video",
    "fusion_score": 0,
    "video_score": 83.77,
    "audio_score": 0,
    "text_score": 0,
    "chatbot_explanation": "**HCIS Analysis Results Explanation**\n\nThe Holistic Content Integrity System (HCIS) has analyzed the content and provided the following verdict:\n\n**Overall Verdict:** UNKNOWN\nThis indicates that the system was unable to make a conclusive determination about the authenticity or legitimacy of the content.\n\n**Final Score:** 0.0%\nThe final score represents the overall confidence level of the HCIS in its analysis, which is 0% in this case. This suggests that the system is highly uncertain and cannot provide a definitive answer.\n\n**System Confidence:** 34.0%\nThis value indicates the degree to which the HCIS is confident in its analysis. A lower confidence score suggests that the system is less certain about its findings.\n\n**Component Scores:**\n\n* **Video Analysis:** 0.0%\nThe video analysis component detected no suspicious or fake activity, scoring a 0%.\n* **Audio Analysis:** 0.0%\nThe audio analysis component also detected no suspicious or fake activity, scoring a 0%.\n* **Text Verification:** 0.0%\nThe text verification component did not detect any inconsistencies or red flags in the text content, scoring a 0%.\n\n**Technical Explanation:**\nThe HCIS relies on various algorithms and techniques to analyze the content. In this case, none of these components were able to identify any suspicious activity, which led to the overall verdict of UNKNOWN.\n\n**Recommendations:**\n\n1. Further analysis is recommended to gain more insight into the content.\n2. Consider collecting additional data or context to help inform the HCIS's decision-making process.\n3. If possible, verify the content through other means, such as manual review or consultation with experts.\n\nIf you have any questions about these results or would like further clarification on the technical explanation, please don't hesitate to ask!",
    "message": "Analysis Complete",
    "download_path": "/uploads/original.mp4"
  },
  {
    "id": 1761141074635,
    "uploadDate": "2025-10-22T19:21:14.635365",
    "fileName": "SABRINA_CAPRENTER_KISSING_WALLPAPER_4K_HD.mp4",
    "fileType": "video",
    "fusion_score": 0,
    "video_score": 24.09,
    "audio_score": 0,
    "text_score": 0,
    "chatbot_explanation": "**HCIS Analysis Results Explanation**\n\nOur Holistic Content Integrity System (HCIS) has conducted an analysis on the provided content, but unfortunately, we were unable to determine its authenticity with certainty.\n\nThe overall verdict is \"UNKNOWN\", indicating that our system was not able to confidently classify the content as authentic or fake. The low system confidence score of 14.0% further reinforces this uncertainty.\n\nEach component analysis also returned a low score:\n\n* **Video Analysis**: No anomalies were detected, suggesting that the video appears to be genuine.\n* **Audio Analysis**: Similar to the video, no suspicious patterns or inconsistencies were found, leading us to believe that the audio is authentic.\n* **Text Verification**: Our text verification tools did not detect any notable discrepancies or red flags.\n\nGiven these results, we cannot conclusively determine whether the content is authentic or fake. We recommend further verification through additional checks and analysis from multiple sources before making a final determination.\n\nIf you have any questions about our detection methods or would like to discuss further, please let us know!",
    "message": "Analysis Complete",
    "download_path": "/uploads/SABRINA_CAPRENTER_KISSING_WALLPAPER_4K_HD.mp4"
  }
]